"369","ZB4Z-QDCL","Oui, vous utilisez un agenda numérique","","Anticiper le rendu en organisant le travail sur plusieurs semaines","Tous les jours",35,"Adapté","Non","Plus rarement","Vous prenez des notes, mais seulement ce qui vous paraît important","","Papier (cahier, bloc-notes, feuilles, ...)",NA,"Vous les relisez;Vous les recopiez au propre;Vous les vérifiez et les complètez;Vous surlignez / soulignez / entourez les éléments importants;Vous les résumez / synthétisez","","Vous le faites tout seul","Vous le faites tout seul","Vous le faites tout seul","Vous le faites tout seul","Vous le faites tout seul","Vous le faites tout seul","Vous le faites avec des camarades de promotion","Vous demandez des explications","","","A un camarade de la formation;A un ou une de mes amis;A un ou une membre de ma famille","Quelques jours par mois","Tous les jours de la semaine ou presque","Tous les jours de la semaine ou presque","Tous les jours de la semaine ou presque","Copié ou déplacé des fichiers sur votre ordinateur, smartphone ou tablette;Utilisé un logiciel de bureautique (traitement de texte, tableur, diaporama...);Ecrit un programme en langage informatique;Modifié les paramètres de votre système d'exploitation (pour régler l'affichage, ajouter des périphériques, etc.);Installé des logiciels ou des applications sur l'un de vos appareils numériques;Utilisé un logiciel spécialisé (PAO, montage, traitements statistiques, modélisation...)","Vous n'utilisez pas","Bon","Vous n'utilisez pas","Vous n'utilisez pas","Vous n'utilisez pas","Moins d’une fois par mois","Une à deux fois par mois","Vous ne l'utilisez pas","Vous ne l'utilisez pas","Vous ne la connaissez pas","Vous ne la connaissez pas","","Oui","Non, vous n’avez pas reçu de formation ou vous n'en avez pas suivi vous-même","Générer des images ou des vidéos;Résumer ou reformuler des textes, articles ou cours;Trouver des explications sur un concept scientifique ou technique;Préparer ou structurer un exposé, un mémoire ou un rapport;Vérifier la qualité linguistique ou la clarté d’un texte;Créer des quiz, exercices ou fiches de révision","","Gagner du temps;Améliorer l’efficacité de vos apprentissages : mieux comprendre certains sujets, obtenir des explications, synthétiser les cours, etc.;Développer vos compétences : apprendre à utiliser de nouveaux outils, améliorer vos compétences en rédaction, programmation, etc.;Augmenter votre créativité : trouver des idées nouvelles, varier vos méthodes de travail;Bénéficier d’une aide personnalisée, recevoir des conseils adaptés à mes besoins;Vous entraîner, vous tester : générer des questions, des tests, des quiz","","Non","Oui","Vous les modifiez fortement, ils ne vous servent que de guide","Item4","Vous préférez faire les choses par vous-même;Vous craignez de devenir dépendant","","","","","","","","Travaux écrits à rendre (dossier, devoir, rapport, fiche de lecture, etc.);Devoirs sur table (questions, QCM, études de cas, problèmes, etc.);Présentations orales (exposé individuel ou en groupe, soutenance, entretien, etc.);Travaux pratiques, stages ou activités appliquées évaluées (en laboratoire, en atelier, à l’hôpital, sur le terrain, etc.);Projets ou productions à mener dans la durée (projet, mémoire, portfolio, simulation, etc.)","","Oui souvent","Assez bon","Valider l’année ou obtenir le diplôme","Item6","Pas du tout d'accord","Pas du tout d'accord","Tout à fait d'accord","Tout à fait d'accord","Vous avez fait des connaissances;Vous avez noué des amitiés","Oui et vous en faites partie","Tous les jours ou presque","Tous les jours ou presque","Tous les jours ou presque","Tous les jours ou presque","Une fois par mois ou plus rarement","Une fois par mois ou plus rarement","","Tous les jours de la semaine ou presque","Des questions liées aux cours ou évaluations;Le suivi d’un stage, projet ou mémoire","","Plutôt oui","Vous avez un travail rémunéré en parallèle de vos études",NA,"Bac + 1 à Bac + 2","Aucun ou BEPC","Un handicap moteur et/ou sensoriel (vue, ouïe…);Un autre problème de santé de longue durée ou une maladie chronique","","Non",NA,"02/12/2025 15:21:24","02/12/2025 15:21:24","02/12/2025 15:35:01","816,4138321","FR","Smartphone","Terminé","BUT/LP",12508857,"I.U.T. 2 - GRENOBLE","BUT","LKB1ML210","BUT1","Information - Communication","Métiers du Livre et du Patrimoine","IUT2","Sciences de l'info. et de la communicat.","GRENOBLE - 1A BUT INFORMATION-COMMUNICATION PARCOURS MÉTIERS DU LIVRE ET DU PATRIMOINE - FI/FC/RE","F",18,"Formation initiale","STMG -Sc. Techno. management et gestion","Bac STMG",1,"Non boursier","Domicile parental","Enseignement secondaire (y compris par correspondance)"
"370","PDHK-LYHN","Oui, vous utilisez un agenda numérique","","Faire le travail quelques jours avant la date finale","Au moins une fois par semaine",28,"Adapté","Non","Jamais","Vous prenez des notes, mais seulement ce qui vous paraît important","","Papier (cahier, bloc-notes, feuilles, ...)",NA,"Vous les résumez / synthétisez;Vous n'en faites rien","","Vous le faites tout seul","Vous ne le faites pas","Vous ne le faites pas","Vous le faites tout seul","Vous ne le faites pas","Vous ne le faites pas","Vous le faites tout seul","Vous faites des recherche complémentaires par vous-même","IAG*;Autre","reprendre le cours","","Tous les jours de la semaine ou presque","Tous les jours de la semaine ou presque","Quelques jours par mois","Tous les jours de la semaine ou presque","Copié ou déplacé des fichiers sur votre ordinateur, smartphone ou tablette;Utilisé un logiciel de bureautique (traitement de texte, tableur, diaporama...);Ecrit un programme en langage informatique;Modifié les paramètres de votre système d'exploitation (pour régler l'affichage, ajouter des périphériques, etc.);Installé des logiciels ou des applications sur l'un de vos appareils numériques;Utilisé un logiciel spécialisé (PAO, montage, traitements statistiques, modélisation...)","Moyen","Moyen","Bon","Vous n'utilisez pas","Vous n'utilisez pas","Une à deux fois par semaine","Vous ne l'utilisez pas","Vous ne l'utilisez pas","Vous ne l'utilisez pas","Vous ne l'utilisez pas","Moins d’une fois par mois","midjourney","Non","Oui : apprendre à utiliser ces outils fait l’objet de cours spécifiques dans votre formation","Résumer ou reformuler des textes, articles ou cours;Trouver des explications sur un concept scientifique ou technique;Préparer ou structurer un exposé, un mémoire ou un rapport;Vérifier la qualité linguistique ou la clarté d’un texte","","Gagner du temps;Obtenir de meilleures notes : générer des contenus de qualité, éviter les erreurs, soigner la forme..;Bénéficier d’une aide personnalisée, recevoir des conseils adaptés à mes besoins","","Non","Oui","Vous les modifiez fortement, ils ne vous servent que de guide","Item7","Vous préférez faire les choses par vous-même;Vos enseignants interdisent leur utilisation;Vous êtes préoccupé par les conséquences environnementales;Vous ne voulez/pas ou ne pouvez pas payer les versions premium","","","","","","","","Travaux écrits à rendre (dossier, devoir, rapport, fiche de lecture, etc.);Devoirs sur table (questions, QCM, études de cas, problèmes, etc.);Présentations orales (exposé individuel ou en groupe, soutenance, entretien, etc.);Projets ou productions à mener dans la durée (projet, mémoire, portfolio, simulation, etc.)","","Oui souvent","Bon","Valider l’année ou obtenir le diplôme","Item8","Neutre","Pas du tout d'accord","Tout à fait d'accord","Tout à fait d'accord","Vous avez fait des connaissances;Vous avez noué des amitiés","Oui et vous en faites partie","Une fois par semaine","Jamais","Jamais","Une fois par mois ou plus rarement","Une fois par semaine","Jamais","Utiliser dans un travail commun des contenus générés par une IAG*;Collaborer simultanément avec d’autres sur une même IAG*","Au moins une fois par mois","Des questions liées aux cours ou évaluations","","Pas du tout","",NA,"Bac + 3 à Bac + 4","Bac + 5 ou plus","Vous ne vous trouvez dans aucune de ces situations","","Non",NA,"01/12/2025 14:56:09","01/12/2025 20:06:38","01/12/2025 21:11:16","4639,437086","FR","Smartphone","Terminé","BUT/LP",12506093,"I.U.T. 2 - ANTENNE ST MARTIN D'HERES","BUT","LSB1ST210","BUT1","Science des Données","Science des Données","IUT2","Mathématiques et informatique","GRENOBLE - 1A BUT SCIENCE DES DONNEES - FI/FC/RE","M",18,"Formation initiale","Série générale","Bac général",1,"Non boursier","Chambre étudiant","Enseignement secondaire (y compris par correspondance)"
"372","ZXJV-LC9J","Non mais vous planifiez différemment","","Anticiper le rendu en organisant le travail sur plusieurs semaines","Tous les jours",38,"Trop important","Non","Jamais","Vous cherchez à prendre en note tout ce que vous entendez","","Ordinateur portable",NA,"Vous les relisez;Vous surlignez / soulignez / entourez les éléments importants;Vous les résumez / synthétisez","","Vous le faites tout seul;Vous le faites avec des camarades de promotion","Vous le faites tout seul;Vous le faites avec des camarades de promotion","Vous le faites tout seul;Vous le faites avec des camarades de promotion","Vous le faites tout seul;Vous le faites avec des camarades de promotion","Vous le faites tout seul","Vous le faites tout seul","Vous le faites tout seul;Vous le faites avec des camarades de promotion","Vous faites des recherche complémentaires par vous-même;Vous demandez des explications","Livres (ouvrages ou manuels);Articles de recherche (revues scientifiques);Articles de vulgarisation (revues grand public, médias type The conversation, AOC…);Podcasts / vidéos;Sites internet;Réseaux sociaux (Instagram, TikTok…)","","A un camarade de la formation;A la personne chargée de l’enseignement","Un jour par semaine","Tous les jours de la semaine ou presque","Tous les jours de la semaine ou presque","Tous les jours de la semaine ou presque","Copié ou déplacé des fichiers sur votre ordinateur, smartphone ou tablette;Utilisé un logiciel de bureautique (traitement de texte, tableur, diaporama...);Ecrit un programme en langage informatique;Modifié les paramètres de votre système d'exploitation (pour régler l'affichage, ajouter des périphériques, etc.);Installé des logiciels ou des applications sur l'un de vos appareils numériques;Utilisé un logiciel spécialisé (PAO, montage, traitements statistiques, modélisation...);Installé ou géré un serveur informatique","Bon","Très bon","Moyen","Vous n'utilisez pas","Vous n'utilisez pas","Vous ne l'utilisez pas","Une à deux fois par semaine","Vous ne la connaissez pas","Vous ne l'utilisez pas","Vous ne la connaissez pas","Vous ne la connaissez pas","","Non","Non, vous n’avez pas reçu de formation ou vous n'en avez pas suivi vous-même","Résumer ou reformuler des textes, articles ou cours","","Gagner du temps","","Non","Non","Cela ne vous concerne pas, vous n'en utilisez pas","Item2","Vous préférez faire les choses par vous-même;Vos enseignants interdisent leur utilisation;Vous craignez pour la confidentialité des données;Vous êtes préoccupé par les conséquences environnementales;Vous êtes préoccupé par les conséquences sociales et économiques;Vous ne voulez/pas ou ne pouvez pas payer les versions premium;Vous craignez d’être accusé de triche;Vous considérez que c’est une forme de triche;Vous craignez de devenir dépendant","","","","","","","","Travaux écrits à rendre (dossier, devoir, rapport, fiche de lecture, etc.)","","Oui souvent","Assez bon","Valider l’année ou obtenir le diplôme","Item4","Pas d'accord","Pas du tout d'accord","Neutre","Tout à fait d'accord","Vous avez noué des amitiés","Oui et vous en faites partie","Tous les jours ou presque","Jamais","Une fois par mois ou plus rarement","Une fois par semaine","Une fois par mois ou plus rarement","Une fois par mois ou plus rarement","","Moins souvent","Des questions liées aux cours ou évaluations","","Plutôt non","",NA,"BEP ou CAP","Bac + 5 ou plus","Un trouble psychique","","Non",NA,"03/12/2025 15:14:59","03/12/2025 15:14:59","03/12/2025 15:36:44","1304,653181","FR","Tablette","Terminé","BUT/LP",12509164,"I.U.T. 2 - GRENOBLE","BUT","LKB1ML210","BUT1","Information - Communication","Métiers du Livre et du Patrimoine","IUT2","Sciences de l'info. et de la communicat.","GRENOBLE - 1A BUT INFORMATION-COMMUNICATION PARCOURS MÉTIERS DU LIVRE ET DU PATRIMOINE - FI/FC/RE","F",21,"Formation initiale","Série générale","Bac général",1,"Boursier","Logement personnel hors chambre étudiant","NON SCOLARISE l'année précédente MAIS PRECEDEMMENT ENTRE dans l'enseignement supérieur en France universitaire ou non"
"373","K9ZD-YV4G","Oui, vous utilisez un agenda numérique","","Anticiper le rendu en organisant le travail sur plusieurs semaines;Faire le travail quelques jours avant la date finale","Au moins une fois par semaine",35,"Trop important","Oui","Jamais","Vous cherchez à prendre en note tout ce que vous entendez;Vous prenez des notes, mais seulement ce qui vous paraît important","","Papier (cahier, bloc-notes, feuilles, ...);Ordinateur portable",NA,"Vous surlignez / soulignez / entourez les éléments importants;Vous les rangez dans des dossiers","","Vous le faites tout seul;Vous le faites avec des camarades de promotion","Vous le faites tout seul;Vous le faites avec des camarades de promotion","Vous ne le faites pas","Vous le faites tout seul;Vous le faites avec des camarades de promotion","Vous le faites tout seul","Vous ne le faites pas","Vous le faites avec des camarades de promotion","Vous faites des recherche complémentaires par vous-même;Vous demandez des explications","Livres (ouvrages ou manuels);Articles de recherche (revues scientifiques);Articles de vulgarisation (revues grand public, médias type The conversation, AOC…);Podcasts / vidéos;IAG*","","A un camarade de la formation;A un ou une de mes amis;A la personne chargée de l’enseignement","Un jour par semaine","Quelques jours par mois","Quelques jours par mois","Deux jours par semaine","Copié ou déplacé des fichiers sur votre ordinateur, smartphone ou tablette;Utilisé un logiciel de bureautique (traitement de texte, tableur, diaporama...)","Bon","Très bon","Vous n'utilisez pas","Vous n'utilisez pas","Bon","Moins d’une fois par mois","Vous ne la connaissez pas","Vous ne la connaissez pas","Vous ne la connaissez pas","Vous ne la connaissez pas","Vous ne la connaissez pas","","Oui","Non, vous n’avez pas reçu de formation ou vous n'en avez pas suivi vous-même","Vérifier la qualité linguistique ou la clarté d’un texte","","Gagner du temps","","Non","Non","Cela ne vous concerne pas, vous n'en utilisez pas","Item5","Vous ne savez pas très bien vous en servir;Vous préférez faire les choses par vous-même;Vos enseignants interdisent leur utilisation;Vous craignez pour la confidentialité des données;Vous êtes préoccupé par les conséquences environnementales;Vous êtes préoccupé par les conséquences sociales et économiques;Vous craignez d’être accusé de triche;Vous considérez que c’est une forme de triche","","Oui","donner des idées d'animation","Aucune consigne ne vous a été donnée","","","","Travaux écrits à rendre (dossier, devoir, rapport, fiche de lecture, etc.);Travaux pratiques, stages ou activités appliquées évaluées (en laboratoire, en atelier, à l’hôpital, sur le terrain, etc.)","","Oui souvent","Bon","Valider l’année ou obtenir le diplôme","Item3","Pas du tout d'accord","Pas du tout d'accord","Pas du tout d'accord","Tout à fait d'accord","Vous avez retrouvé des personnes que vous connaissiez déjà","Oui et vous en faites partie","Une fois par semaine","Jamais","Jamais","Une fois par semaine","Une fois par semaine","Une fois par mois ou plus rarement","Rencontrer des tensions dans le groupe à cause de façons différentes d’utiliser les IAG*","Au moins une fois par mois","Le suivi d’un stage, projet ou mémoire;Des questions liées à votre d’orientation ou projet professionnel","","Pas du tout","",NA,"Baccalauréat","Baccalauréat","Un trouble de l’apprentissage (dyslexie, trouble de l’attention avec ou sans hyperactivité)","","Non",NA,"02/12/2025 16:47:26","03/12/2025 07:34:34","03/12/2025 07:36:06","881,7932643","FR","Smartphone","Terminé","BUT/LP",12201432,"I.U.T. 2 - GRENOBLE","BUT","LCB3AN230","BUT3","Carrières Sociales","Animation Sociale et Socioculturelle","IUT2","Sciences de l'info. et de la communicat.","GRENOBLE - 3A BUT CARRIÈRES SOCIALES PARCOURS ANIMATION SOCIALE ET SOCIOCULTURELLE - FI/FC/RE/CP/AP","F",21,"Contrat d'apprentissage","Série générale","Bac général",1,"Non boursier","Autre mode d'hébergement","IUT (y compris post-DUT ou licence professionnelle)"
"378","F8HQ-CVFN","Non, vous ne planifiez pas","","Anticiper le rendu en organisant le travail sur plusieurs semaines","Au moins une fois par semaine",31,"","","Jamais","Vous prenez des notes, mais seulement ce qui vous paraît important","","Papier (cahier, bloc-notes, feuilles, ...)",NA,"Vous les relisez;Vous les recopiez au propre;Vous les rangez dans des dossiers","","Vous le faites tout seul","Vous le faites tout seul","Vous le faites tout seul","Vous le faites tout seul","Vous ne le faites pas","Vous ne le faites pas","Vous ne le faites pas","Vous demandez des explications","","","A un camarade de la formation;A un ou une de mes amis","Tous les jours de la semaine ou presque","Tous les jours de la semaine ou presque","Deux jours par semaine","Tous les jours de la semaine ou presque","Copié ou déplacé des fichiers sur votre ordinateur, smartphone ou tablette;Utilisé un logiciel de bureautique (traitement de texte, tableur, diaporama...);Ecrit un programme en langage informatique;Installé des logiciels ou des applications sur l'un de vos appareils numériques","Vous n'utilisez pas","Moyen","Vous n'utilisez pas","Vous n'utilisez pas","Bon","Moins d’une fois par mois","Vous ne l'utilisez pas","Vous ne l'utilisez pas","Vous ne l'utilisez pas","Vous ne l'utilisez pas","Vous ne l'utilisez pas","","Oui","Non, vous n’avez pas reçu de formation ou vous n'en avez pas suivi vous-même","Résumer ou reformuler des textes, articles ou cours;Vérifier la qualité linguistique ou la clarté d’un texte","","Améliorer l’efficacité de vos apprentissages : mieux comprendre certains sujets, obtenir des explications, synthétiser les cours, etc.","","Non","Non","Vous les modifiez fortement, ils ne vous servent que de guide","Item6","Vous préférez faire les choses par vous-même;Vous craignez d’être accusé de triche;Vous craignez de devenir dépendant","","","","","","","","Devoirs sur table (questions, QCM, études de cas, problèmes, etc.);Présentations orales (exposé individuel ou en groupe, soutenance, entretien, etc.)","","Oui souvent","Bon","Valider l’année ou obtenir le diplôme","Item8","Pas du tout d'accord","Pas du tout d'accord","Pas du tout d'accord","Tout à fait d'accord","Vous avez retrouvé des personnes que vous connaissiez déjà;Vous avez fait des connaissances","Oui et vous n’en faites pas partie","Jamais","Jamais","Jamais","Jamais","Jamais","Jamais","","Jamais","","","Plutôt non","",NA,"Bac + 1 à Bac + 2","BEP ou CAP","Vous ne vous trouvez dans aucune de ces situations","","Non",NA,"02/12/2025 13:45:16","02/12/2025 13:45:16","02/12/2025 14:00:59","943,139023","FR","Smartphone","Terminé","BUT/LP",12503275,"I.U.T. 2 - GRENOBLE","BUT","LIB1IN210","BUT1","Informatique","Informatique ","IUT2","Informatique","GRENOBLE - 1A BUT INFORMATIQUE - FI/FC/RE","M",18,"Formation initiale","Série générale","Bac général",1,"Non boursier","Domicile parental","Enseignement secondaire (y compris par correspondance)"
"382","W7G9-3A7J","Oui, vous utilisez un agenda numérique;Non, vous ne planifiez pas","","Faire le travail quelques jours avant la date finale;Faire le travail les heures précédant la date finale","Au moins une fois par semaine",32,"Trop important","Non","Quelques fois dans le semestre","Vous cherchez à prendre en note tout ce que vous entendez;Vous prenez des notes, mais seulement ce qui vous paraît important","","Papier (cahier, bloc-notes, feuilles, ...)",NA,"Vous les relisez;Vous les rangez dans des dossiers","","Vous le faites tout seul;Vous le faites avec une IAG*","Vous le faites tout seul;Vous le faites avec une IAG*","Vous le faites tout seul;Vous le faites avec une IAG*","Vous le faites tout seul;Vous le faites avec une IAG*","Vous ne le faites pas","Vous le faites tout seul","Vous ne le faites pas","Vous faites des recherche complémentaires par vous-même;Vous demandez des explications","Articles de recherche (revues scientifiques);Articles de vulgarisation (revues grand public, médias type The conversation, AOC…);Podcasts / vidéos;Sites internet;IAG*","","A un camarade de la formation;A la personne chargée de l’enseignement;A une IAG*","Quelques jours par mois","Tous les jours de la semaine ou presque","Tous les jours de la semaine ou presque","Tous les jours de la semaine ou presque","Utilisé un logiciel de bureautique (traitement de texte, tableur, diaporama...);Ecrit un programme en langage informatique;Modifié les paramètres de votre système d'exploitation (pour régler l'affichage, ajouter des périphériques, etc.);Installé des logiciels ou des applications sur l'un de vos appareils numériques","Vous n'utilisez pas","Bon","Bon","Très bon","Vous n'utilisez pas","Une à deux fois par semaine","Vous ne la connaissez pas","Vous ne la connaissez pas","Vous ne la connaissez pas","Vous ne la connaissez pas","Vous ne la connaissez pas","","Non","Non, vous n’avez pas reçu de formation ou vous n'en avez pas suivi vous-même","Générer, corriger ou commenter des lignes de code (Python, R, HTML, etc.);Générer ou corriger une formule ou un calcul (Excel, MATLAB, Python…);Résumer ou reformuler des textes, articles ou cours;Trouver des explications sur un concept scientifique ou technique;Simuler ou analyser un cas pratique (clinique, technique ou expérimental);Créer des quiz, exercices ou fiches de révision","","Gagner du temps;Améliorer l’efficacité de vos apprentissages : mieux comprendre certains sujets, obtenir des explications, synthétiser les cours, etc.;Obtenir de meilleures notes : générer des contenus de qualité, éviter les erreurs, soigner la forme..;Vous entraîner, vous tester : générer des questions, des tests, des quiz","","Oui","Oui","Vous les modifiez légèrement de façon à en gommer les défauts ou les traits reconnaissables (notamment avec un logiciel édité dans ce but)","Item7","Autre","Toléré et conseillé parfois","","","","","","","Travaux écrits à rendre (dossier, devoir, rapport, fiche de lecture, etc.);Devoirs sur table (questions, QCM, études de cas, problèmes, etc.);Présentations orales (exposé individuel ou en groupe, soutenance, entretien, etc.);Travaux pratiques, stages ou activités appliquées évaluées (en laboratoire, en atelier, à l’hôpital, sur le terrain, etc.);Projets ou productions à mener dans la durée (projet, mémoire, portfolio, simulation, etc.)","","Oui souvent","Assez bon","Préparer ou réussir un concours","Item6","D'accord","Pas du tout d'accord","Pas d'accord","Pas d'accord","Vous avez retrouvé des personnes que vous connaissiez déjà","Non","Une fois par semaine","Une fois par semaine","Une fois par semaine","Une fois par mois ou plus rarement","Jamais","Jamais","Partager des contenus créés par une IAG*;Collaborer simultanément avec d’autres sur une même IAG*","Au moins une fois par mois","Le suivi d’un stage, projet ou mémoire;Des difficultés personnelles","","Plutôt non","",NA,"Bac + 5 ou plus","Bac + 5 ou plus","Vous ne vous trouvez dans aucune de ces situations","","Non",NA,"02/12/2025 14:28:23","02/12/2025 14:28:23","02/12/2025 14:47:44","1161,724324","FR","Smartphone","Terminé","BUT/LP",12308509,"I.U.T. 1 - SAINT MARTIN D'HERES","BUT","TCB3ES231","BUT3","Génie Electrique et Informatique Industrielle","Electronique et Systèmes Embarqués","IUT1","Electronique, génie électrique","ST MARTIN D'HERES - 3A BUT GEII - ELECTRONIQUE ET SYSTEMES EMBARQUES","M",20,"Formation initiale","Série générale","Bac général",1,"Non boursier","Logement personnel hors chambre étudiant","IUT (y compris post-DUT ou licence professionnelle)"
