"","X94..CLE","X1..RP_OT_AGENDA","X2..RP_OT_AGENDA_Autre1","X3..RP_OT_DERTRAV_quand","X4..RP_OT_TRAV_freq","X5..RP_OT_COURS_heure","X6..RP_OT_COURS","X7..RP_OT_StageAlternance","X8..RP_EE_ASSID_quand","X9..RP_EE_PNOTE","X10..RP_EE_PNOTE_Autre","X11..RP_EE_PNOTE_outi","X12..RP_EE_PNOTE_outi_Autre","X13..RP_EE_PNOTE_apres","X14..RP_EE_PNOTE_apres_Autre","X15..Resumes","X16..Refs","X17..Liens","X18..Reformule","X19..Schemas","X20..Exos","X21..Interro","X22..RP_BE_DIFF_react","X23..RP_BE_DIFF_react_res","X24..RP_BE_DIFF_react_res_Autre","X25..RP_BE_DIFF_react_explic","X26..AdresseMail","X27..Plateformes","X28..LEO","X29..Camps_UGA","X30..RS_PN_COMP","X31..Recherche","X32..TravailCollab","X33..AnalyseStats","X34..Modelisation","X35..Cybersecurite","X36..ChatGPT","X37..DeepL","X38..Copilot","X39..Grammarly","X40..Perplexity","X41..Autre","X42..RP_PN_IA_type_freq_autres","X43..RS_PN_IA_bes_form","X44..RP_RPT_IA_formation","X45..RP_PN_IA_usages","X46..RP_PN_IA_usages_Autre","X47..RP_PN_IA_raisons","X48..RP_PN_IA_raisons_Autre","X49..RP_PN_IA_paye","X50..RP_PN_IA_prat_diff","X51..RS_PN_IA_reform","X52..RS_PN_IA_conf","X53..RP_PN_IALimites","X54..RP_PN_IALimites_Autre","X55..UsagesIA_AlternanceStages_ON","X56..UsagesIA_AlternanceStages_Ouverte","X57..UsagesIA_AlternanceStages_Encadrement","X58..UsagesIA_AlternanceStages_Encadrem_Autre","X59..RP_PN_NONIA_pourquoi","X60..RP_PN_NONIA_pourquoi_Autre","X61..RP_AP_EVAL_type","X62..RP_AP_EVAL_type_Autre","X63..RP_AP_EVAL_Groupefreq","X64..RP_AP_EVAL_Autopos","X65..RP_AP_EVAL_OBJ","X66..RP_AP_EVAL_clarte","X67..IAGAmelioration","X68..IAGBaisse","X69..Consignes","X70..IAGSanction","X71..RR_SA_FREQ_connaiss","X72..RR_SA_GROUPEPROMO","X73..Notes","X74..Exercices","X75..Conseils","X76..Informations_administratives_ou_pratique","X77..Ressources_complementaires_videos_articl","X78..Conseils_sur_stages_orientation_ou_inser","X79..RR_IA_PART","X80..RP_RE_ECH_freq","X81..RP_RE_ECH_quoi","X82..RP_RE_ECH_quoi_Autre","X83..RP_OS_TRAV","X84..Nature_Contrainte","X85..RP_OS_BOURSE_ech","X86..Parent2","X87..Parent1","X88..SituationsTroublesHandi","X89..COMMENT","X90..QUALI_ON","X93..RP_RE_IA_ens_action","X95..DATE_SAISIE","X96..DATE_ENREG","X97..DATE_MODIF","X98..TEMPS_SAISIE","X100..LANG_SAISIE","X101..APPAREIL_SAISIE","X102..PROGRESSION","X104..Diplome_._Type_lib","X105..Individu_._Code_Etudiant","X110..Composante","Diplôme...Type...lib..","CLEETAPE","DIP...Annee","Mention","Parcours","Composante","Secteur.disciplinaire","IAE...Version.Etape..lib..web.","Individu...Sexe","Naissance...Age","Régime.d.inscription..lib..long.","Bac.ou.équivalence..lib..long.","Série.de.bac","Nb.etu.Nationalité.française","Type.bourse..lib..","Type.d.hébergement..lib..","Situation.année.précédente..lib.."
"1","9RPY-KDQ4","Non, vous ne planifiez pas","","Faire le travail quelques jours avant la date finale","Au moins une fois par semaine",30,"Trop important","Non","Jamais","Vous cherchez à prendre en note tout ce que vous entendez;Vous prenez des notes, mais seulement ce qui vous paraît important","","Papier (cahier, bloc-notes, feuilles, ...);Ordinateur portable",NA,"Vous les relisez;Vous les rangez dans des dossiers","","Vous le faites avec des camarades de promotion","Vous le faites avec des camarades de promotion;Vous le faites avec une IAG*","Vous le faites tout seul;Vous le faites avec des camarades de promotion","Vous ne le faites pas","Vous ne le faites pas","Vous le faites tout seul","Vous le faites avec des camarades de promotion","Vous faites des recherche complémentaires par vous-même","Sites internet;IAG*","","","Tous les jours de la semaine ou presque","Tous les jours de la semaine ou presque","Deux jours par semaine","Tous les jours de la semaine ou presque","Copié ou déplacé des fichiers sur votre ordinateur, smartphone ou tablette;Utilisé un logiciel de bureautique (traitement de texte, tableur, diaporama...);Ecrit un programme en langage informatique;Installé des logiciels ou des applications sur l'un de vos appareils numériques;Utilisé un logiciel spécialisé (PAO, montage, traitements statistiques, modélisation...)","Mauvais","Moyen","Moyen","Vous n'utilisez pas","Mauvais","Une à deux fois par semaine","Vous ne l'utilisez pas","Vous ne la connaissez pas","Vous ne la connaissez pas","Vous ne la connaissez pas","Vous ne l'utilisez pas","","Oui","Oui : apprendre à utiliser ces outils fait l’objet de cours spécifiques dans votre formation;Oui, de votre propre initiative, en consultant des ressources sur le sujet","Concevoir des supports visuels (infographies, schémas, présentations);Générer des images ou des vidéos;Générer, corriger ou commenter des lignes de code (Python, R, HTML, etc.);Générer ou corriger une formule ou un calcul (Excel, MATLAB, Python…);Résumer ou reformuler des textes, articles ou cours;Concevoir ou optimiser un modèle / prototype / protocole;Préparer ou structurer un exposé, un mémoire ou un rapport","","Gagner du temps;Améliorer l’efficacité de vos apprentissages : mieux comprendre certains sujets, obtenir des explications, synthétiser les cours, etc.;Obtenir de meilleures notes : générer des contenus de qualité, éviter les erreurs, soigner la forme..;Développer vos compétences : apprendre à utiliser de nouveaux outils, améliorer vos compétences en rédaction, programmation, etc.;Bénéficier d’une aide personnalisée, recevoir des conseils adaptés à mes besoins;Vous entraîner, vous tester : générer des questions, des tests, des quiz","","Non","Oui","Vous les modifiez légèrement de façon à en gommer les défauts ou les traits reconnaissables (notamment avec un logiciel édité dans ce but)","Item5","Vous préférez faire les choses par vous-même;Vos enseignants interdisent leur utilisation;Vous craignez pour la confidentialité des données;Vous êtes préoccupé par les conséquences environnementales;Vous ne voulez/pas ou ne pouvez pas payer les versions premium;Vous craignez d’être accusé de triche;Vous considérez que c’est une forme de triche;Vous craignez de devenir dépendant","","","","","","","","Travaux écrits à rendre (dossier, devoir, rapport, fiche de lecture, etc.);Devoirs sur table (questions, QCM, études de cas, problèmes, etc.);Présentations orales (exposé individuel ou en groupe, soutenance, entretien, etc.);Projets ou productions à mener dans la durée (projet, mémoire, portfolio, simulation, etc.)","","Oui quelques fois","Passable","Valider avec une mention","Item6","Neutre","Neutre","Tout à fait d'accord","Tout à fait d'accord","Vous avez retrouvé des personnes que vous connaissiez déjà;Vous avez fait des connaissances;Vous avez noué des amitiés","Oui et vous en faites partie","Une fois par semaine","Une fois par semaine","Une fois par semaine","Une fois par semaine","Une fois par mois ou plus rarement","Une fois par semaine","Partager des contenus créés par une IAG*;Utiliser dans un travail commun des contenus générés par une IAG*;Collaborer simultanément avec d’autres sur une même IAG*","Au moins une fois par mois","Votre travail et vos résultats","","Plutôt non","",NA,"Bac + 3 à Bac + 4","Bac + 3 à Bac + 4","Un handicap moteur et/ou sensoriel (vue, ouïe…);Un trouble de l’apprentissage (dyslexie, trouble de l’attention avec ou sans hyperactivité)","Non","Oui",NA,"01/12/2025 14:03:02","01/12/2025 14:03:02","01/12/2025 14:38:57","1953,069372","FR","PC","Terminé","BUT/LP",12412920,"I.U.T. 2 - ANTENNE ST MARTIN D'HERES","BUT","LSB2CO220","BUT2","Science des Données","Visualisation, Conception d'Outils Décisionnels","IUT2","Mathématiques et informatique","GRENOBLE - 2A BUT SCIENCE DES DONNEES - VISUALISATION,CONCEPTION D'OUTILS DECISIONNELS - FI/FC/RE","M",19,"Formation initiale","Série générale","Bac général",1,"Boursier","Logement HLM-CROUS (convention)","IUT (y compris post-DUT ou licence professionnelle)"
"3","C3RP-4AXL","Oui, vous utilisez un agenda papier","","Faire le travail quelques jours avant la date finale;Faire le travail les heures précédant la date finale","Uniquement avant une évaluation",35,"Adapté","Non","Jamais","Vous prenez des notes, mais seulement ce qui vous paraît important;Vous utilisez les notes d'une autre personne","","Tablette",NA,"Vous les relisez;Vous n'en faites rien","","Vous le faites avec une IAG*","Vous ne le faites pas","Vous le faites avec une IAG*","Vous ne le faites pas","Vous ne le faites pas","Vous ne le faites pas","Vous le faites avec une IAG*","Vous ne faites rien","","","","Tous les jours de la semaine ou presque","Tous les jours de la semaine ou presque","Tous les jours de la semaine ou presque","Tous les jours de la semaine ou presque","Copié ou déplacé des fichiers sur votre ordinateur, smartphone ou tablette;Utilisé un logiciel de bureautique (traitement de texte, tableur, diaporama...);Ecrit un programme en langage informatique;Installé des logiciels ou des applications sur l'un de vos appareils numériques;Utilisé un logiciel spécialisé (PAO, montage, traitements statistiques, modélisation...)","Moyen","Très bon","Moyen","Vous n'utilisez pas","Bon","Tous les jours ou presque","Moins d’une fois par mois","Vous ne l'utilisez pas","Vous ne la connaissez pas","Moins d’une fois par mois","Tous les jours ou presque","Gemini, Mistral","Non","Oui, de votre propre initiative, en consultant des ressources sur le sujet","Générer, corriger ou commenter des lignes de code (Python, R, HTML, etc.);Résumer ou reformuler des textes, articles ou cours;Trouver des explications sur un concept scientifique ou technique;Préparer ou structurer un exposé, un mémoire ou un rapport;Vérifier la qualité linguistique ou la clarté d’un texte;Créer des quiz, exercices ou fiches de révision","","Gagner du temps;Améliorer l’efficacité de vos apprentissages : mieux comprendre certains sujets, obtenir des explications, synthétiser les cours, etc.;Obtenir de meilleures notes : générer des contenus de qualité, éviter les erreurs, soigner la forme..;Développer vos compétences : apprendre à utiliser de nouveaux outils, améliorer vos compétences en rédaction, programmation, etc.;Vous entraîner, vous tester : générer des questions, des tests, des quiz","","Non","Oui","Vous les modifiez fortement, ils ne vous servent que de guide","Item6","Vos enseignants interdisent leur utilisation;Vous ne voulez/pas ou ne pouvez pas payer les versions premium;Vous craignez d’être accusé de triche","","","","","","","","Travaux écrits à rendre (dossier, devoir, rapport, fiche de lecture, etc.);Devoirs sur table (questions, QCM, études de cas, problèmes, etc.);Présentations orales (exposé individuel ou en groupe, soutenance, entretien, etc.)","","Oui quelques fois","Passable","Valider l’année ou obtenir le diplôme","Item3","Tout à fait d'accord","Pas du tout d'accord","D'accord","Neutre","Vous avez fait des connaissances;Vous avez noué des amitiés","Oui et vous en faites partie","Une fois par mois ou plus rarement","Jamais","Jamais","Une fois par mois ou plus rarement","Jamais","Jamais","Partager des contenus créés par une IAG*;Utiliser dans un travail commun des contenus générés par une IAG*","Au moins une fois par semaine","Autre","","Plutôt oui","Vous avez un travail rémunéré en parallèle de vos études",NA,"Bac + 1 à Bac + 2","Baccalauréat","Vous ne vous trouvez dans aucune de ces situations","","Non",NA,"03/12/2025 14:26:40","03/12/2025 14:26:40","03/12/2025 14:41:53","913,6796063","FR","Smartphone","Terminé","BUT/LP",12501955,"I.U.T. 2 - GRENOBLE","BUT","LKB1ML210","BUT1","Information - Communication","Métiers du Livre et du Patrimoine","IUT2","Sciences de l'info. et de la communicat.","GRENOBLE - 1A BUT INFORMATION-COMMUNICATION PARCOURS MÉTIERS DU LIVRE ET DU PATRIMOINE - FI/FC/RE","F",18,"Formation initiale","0022-bacs professionnels tertiaires","Bac pro",1,"Non boursier","Chambre étudiant","Enseignement secondaire (y compris par correspondance)"
"7","EF44-X7QG","Oui, vous utilisez un agenda numérique","","Anticiper le rendu en organisant le travail sur plusieurs semaines;Faire le travail quelques jours avant la date finale","Tous les jours",32,"Adapté","Non","Plus rarement","Vous cherchez à prendre en note tout ce que vous entendez","","Papier (cahier, bloc-notes, feuilles, ...)",NA,"Vous les relisez;Vous les recopiez au propre;Vous les vérifiez et les complètez;Vous surlignez / soulignez / entourez les éléments importants;Vous les résumez / synthétisez","","Vous le faites tout seul","Vous le faites tout seul","Vous le faites tout seul","Vous le faites tout seul","Vous ne le faites pas","Vous ne le faites pas","Vous ne le faites pas","Vous faites des recherche complémentaires par vous-même","Articles de vulgarisation (revues grand public, médias type The conversation, AOC…);Articles de presse;Podcasts / vidéos;Sites internet","","","Tous les jours de la semaine ou presque","Tous les jours de la semaine ou presque","Quelques jours par mois","Tous les jours de la semaine ou presque","Copié ou déplacé des fichiers sur votre ordinateur, smartphone ou tablette;Utilisé un logiciel de bureautique (traitement de texte, tableur, diaporama...);Ecrit un programme en langage informatique;Modifié les paramètres de votre système d'exploitation (pour régler l'affichage, ajouter des périphériques, etc.);Installé des logiciels ou des applications sur l'un de vos appareils numériques;Utilisé un logiciel spécialisé (PAO, montage, traitements statistiques, modélisation...)","Moyen","Bon","Mauvais","Mauvais","Mauvais","Une à deux fois par mois","Une à deux fois par mois","Vous ne l'utilisez pas","Vous ne la connaissez pas","Vous ne la connaissez pas","Vous ne la connaissez pas","","Non","Non, vous n’avez pas reçu de formation ou vous n'en avez pas suivi vous-même","Résumer ou reformuler des textes, articles ou cours","","Obtenir de meilleures notes : générer des contenus de qualité, éviter les erreurs, soigner la forme..;Augmenter votre créativité : trouver des idées nouvelles, varier vos méthodes de travail","","Non","Oui","Vous les modifiez fortement, ils ne vous servent que de guide","Item5","Vous préférez faire les choses par vous-même;Vos enseignants interdisent leur utilisation;Vous êtes préoccupé par les conséquences environnementales;Vous ne voulez/pas ou ne pouvez pas payer les versions premium;Vous craignez d’être accusé de triche;Vous considérez que c’est une forme de triche;Vous craignez de devenir dépendant","","","","","","","","Travaux écrits à rendre (dossier, devoir, rapport, fiche de lecture, etc.);Devoirs sur table (questions, QCM, études de cas, problèmes, etc.);Présentations orales (exposé individuel ou en groupe, soutenance, entretien, etc.)","","Oui quelques fois","Bon","Valider l’année ou obtenir le diplôme;Valider avec une mention","Item7","Neutre","Neutre","Tout à fait d'accord","Tout à fait d'accord","Vous avez retrouvé des personnes que vous connaissiez déjà;Vous avez fait des connaissances;Vous avez noué des amitiés","Oui et vous en faites partie","Une fois par mois ou plus rarement","Une fois par mois ou plus rarement","Une fois par semaine","Une fois par semaine","Une fois par mois ou plus rarement","Une fois par semaine","","Au moins une fois par mois","Des questions liées aux cours ou évaluations;Le suivi d’un stage, projet ou mémoire;Des difficultés personnelles","","Plutôt non","",NA,"Bac + 1 à Bac + 2","Bac + 1 à Bac + 2","Vous ne vous trouvez dans aucune de ces situations","","Non",NA,"03/12/2025 15:14:42","03/12/2025 15:14:42","03/12/2025 15:29:19","877,4884147","FR","Smartphone","Terminé","BUT/LP",12501679,"I.U.T. 2 - GRENOBLE","BUT","LKB1ML210","BUT1","Information - Communication","Métiers du Livre et du Patrimoine","IUT2","Sciences de l'info. et de la communicat.","GRENOBLE - 1A BUT INFORMATION-COMMUNICATION PARCOURS MÉTIERS DU LIVRE ET DU PATRIMOINE - FI/FC/RE","F",18,"Formation initiale","Série générale","Bac général",1,"Non boursier","Résidence universitaire","Enseignement secondaire (y compris par correspondance)"
"8","DP5V-WD7K","Oui, vous utilisez un agenda numérique","","Anticiper le rendu en organisant le travail sur plusieurs semaines","Tous les jours",35,"Trop important","Non","Plus rarement","Vous prenez des notes, mais seulement ce qui vous paraît important","","Papier (cahier, bloc-notes, feuilles, ...)",NA,"Vous les recopiez au propre;Vous surlignez / soulignez / entourez les éléments importants;Vous les résumez / synthétisez","","Vous le faites tout seul","Vous le faites tout seul","Vous le faites tout seul","Vous le faites tout seul","Vous le faites tout seul","Vous le faites tout seul","Vous le faites tout seul","Vous faites des recherche complémentaires par vous-même;Vous demandez des explications","Sites internet","","A un camarade de la formation;A un ou une de mes amis;A la personne chargée de l’enseignement","Tous les jours de la semaine ou presque","Tous les jours de la semaine ou presque","Tous les jours de la semaine ou presque","Tous les jours de la semaine ou presque","Copié ou déplacé des fichiers sur votre ordinateur, smartphone ou tablette;Utilisé un logiciel de bureautique (traitement de texte, tableur, diaporama...);Ecrit un programme en langage informatique;Utilisé un logiciel spécialisé (PAO, montage, traitements statistiques, modélisation...)","Vous n'utilisez pas","Bon","Très mauvais","Vous n'utilisez pas","Vous n'utilisez pas","Une à deux fois par semaine","Une à deux fois par semaine","Vous ne la connaissez pas","Vous ne la connaissez pas","Vous ne la connaissez pas","Vous ne la connaissez pas","","Non","Non, vous n’avez pas reçu de formation ou vous n'en avez pas suivi vous-même","Créer des quiz, exercices ou fiches de révision","","Gagner du temps","","Non","Oui","Vous les modifiez fortement, ils ne vous servent que de guide","Item6","Vous êtes préoccupé par les conséquences sociales et économiques;Vous ne voulez/pas ou ne pouvez pas payer les versions premium;Vous craignez d’être accusé de triche","","","","","","","","Travaux écrits à rendre (dossier, devoir, rapport, fiche de lecture, etc.);Devoirs sur table (questions, QCM, études de cas, problèmes, etc.);Présentations orales (exposé individuel ou en groupe, soutenance, entretien, etc.)","","Oui souvent","Bon","Valider l’année ou obtenir le diplôme","Item4","Pas d'accord","Pas d'accord","D'accord","Neutre","Vous avez noué des amitiés","Oui et vous en faites partie","Une fois par mois ou plus rarement","Une fois par semaine","Une fois par semaine","Une fois par semaine","Une fois par semaine","Une fois par semaine","Utiliser dans un travail commun des contenus générés par une IAG*","Moins souvent","Des questions liées aux cours ou évaluations;Le suivi d’un stage, projet ou mémoire","","Plutôt non","",NA,"Bac + 3 à Bac + 4","Bac + 5 ou plus","Vous ne vous trouvez dans aucune de ces situations","","Oui",NA,"03/12/2025 15:14:57","03/12/2025 15:14:57","03/12/2025 15:29:40","883,6243139","FR","Smartphone","Terminé","BUT/LP",12508136,"I.U.T. 2 - GRENOBLE","BUT","LKB1ML210","BUT1","Information - Communication","Métiers du Livre et du Patrimoine","IUT2","Sciences de l'info. et de la communicat.","GRENOBLE - 1A BUT INFORMATION-COMMUNICATION PARCOURS MÉTIERS DU LIVRE ET DU PATRIMOINE - FI/FC/RE","F",18,"Formation initiale","Série générale","Bac général",1,"Non boursier","Domicile parental","Enseignement secondaire (y compris par correspondance)"
"9","J3ZM-PKQ3","Oui, vous utilisez un agenda papier","","Faire le travail quelques jours avant la date finale","Au moins une fois par semaine",35,"Adapté","Non","Plus rarement","Vous écoutez sans prendre de notes;Vous prenez des notes, mais seulement ce qui vous paraît important","","Papier (cahier, bloc-notes, feuilles, ...)",NA,"Vous les relisez;Vous surlignez / soulignez / entourez les éléments importants;Vous les résumez / synthétisez","","Vous le faites tout seul","Vous ne le faites pas","Vous ne le faites pas","Vous le faites avec des camarades de promotion","Vous ne le faites pas","Vous le faites tout seul","Vous le faites avec des camarades de promotion","Vous faites des recherche complémentaires par vous-même;Vous demandez des explications","Podcasts / vidéos;Sites internet","","A un camarade de la formation;A la personne chargée de l’enseignement","Tous les jours de la semaine ou presque","Deux jours par semaine","Deux jours par semaine","Tous les jours de la semaine ou presque","Copié ou déplacé des fichiers sur votre ordinateur, smartphone ou tablette","Vous n'utilisez pas","Très bon","Vous n'utilisez pas","Moyen","Vous n'utilisez pas","Une à deux fois par mois","Vous ne la connaissez pas","Vous ne la connaissez pas","Vous ne l'utilisez pas","Moins d’une fois par mois","Vous ne la connaissez pas","","Non","Non, vous n’avez pas reçu de formation ou vous n'en avez pas suivi vous-même","Résumer ou reformuler des textes, articles ou cours;Trouver des explications sur un concept scientifique ou technique;Préparer ou structurer un exposé, un mémoire ou un rapport;Planifier votre travail ou organiser votre emploi du temps","","Gagner du temps;Améliorer l’efficacité de vos apprentissages : mieux comprendre certains sujets, obtenir des explications, synthétiser les cours, etc.;Augmenter votre créativité : trouver des idées nouvelles, varier vos méthodes de travail;Bénéficier d’une aide personnalisée, recevoir des conseils adaptés à mes besoins","","Non","Oui","Vous les modifiez légèrement de façon à en gommer les défauts ou les traits reconnaissables (notamment avec un logiciel édité dans ce but)","Item3","Vous n’avez pas besoin;Vous préférez faire les choses par vous-même;Vos enseignants interdisent leur utilisation;Vous êtes préoccupé par les conséquences environnementales;Vous êtes préoccupé par les conséquences sociales et économiques;Vous ne voulez/pas ou ne pouvez pas payer les versions premium;Vous craignez d’être accusé de triche;Vous craignez de devenir dépendant","","","","","","","","Travaux écrits à rendre (dossier, devoir, rapport, fiche de lecture, etc.);Devoirs sur table (questions, QCM, études de cas, problèmes, etc.)","","Oui souvent","Assez bon","Valider l’année ou obtenir le diplôme","Item5","Neutre","Pas du tout d'accord","Pas d'accord","D'accord","Vous avez retrouvé des personnes que vous connaissiez déjà;Vous avez fait des connaissances","Oui et vous en faites partie","Une fois par mois ou plus rarement","Une fois par mois ou plus rarement","Une fois par mois ou plus rarement","Une fois par semaine","Une fois par mois ou plus rarement","Jamais","","Moins souvent","Des questions liées aux cours ou évaluations;Le suivi d’un stage, projet ou mémoire;Des questions liées à votre d’orientation ou projet professionnel","","Plutôt non","",NA,"Bac + 5 ou plus","Bac + 1 à Bac + 2","Vous ne vous trouvez dans aucune de ces situations","","Non",NA,"02/12/2025 16:08:45","02/12/2025 16:08:45","02/12/2025 16:26:37","1071,835359","FR","Smartphone","Terminé","BUT/LP",12502386,"I.U.T. 1 - SAINT MARTIN D'HERES","BUT","TBB1FI211","BUT1","Génie Civil Construction Durable","Génie Civil Construction Durable","IUT1","Génie civil","ST MARTIN D'HERES - 1A BUT GENIE CIVIL - CONSTRUCTION DURABLE","F",18,"Formation initiale","Série générale","Bac général",1,"Boursier","Domicile parental","Enseignement secondaire (y compris par correspondance)"
