"104","M2AA-UKK5","Oui, vous utilisez un agenda papier","","Faire le travail quelques jours avant la date finale","Au moins une fois par semaine",36,"Adapté","Non","Jamais","Vous prenez des notes, mais seulement ce qui vous paraît important","","Papier (cahier, bloc-notes, feuilles, ...)",NA,"Vous les relisez;Vous les résumez / synthétisez","","Vous le faites tout seul","Vous ne le faites pas","Vous le faites tout seul","Vous le faites avec des camarades de promotion","Vous le faites tout seul","Vous le faites tout seul;Vous le faites avec des camarades de promotion;Vous le faites avec une IAG*","Vous ne le faites pas","Vous demandez des explications","","","A un camarade de la formation;A la personne chargée de l’enseignement;A une IAG*","Tous les jours de la semaine ou presque","Tous les jours de la semaine ou presque","Quelques jours par mois","Tous les jours de la semaine ou presque","Copié ou déplacé des fichiers sur votre ordinateur, smartphone ou tablette;Utilisé un logiciel de bureautique (traitement de texte, tableur, diaporama...);Ecrit un programme en langage informatique;Installé des logiciels ou des applications sur l'un de vos appareils numériques;Utilisé un logiciel spécialisé (PAO, montage, traitements statistiques, modélisation...)","Vous n'utilisez pas","Très bon","Bon","Vous n'utilisez pas","Bon","Une à deux fois par semaine","Moins d’une fois par mois","Moins d’une fois par mois","Vous ne la connaissez pas","Vous ne la connaissez pas","Vous ne la connaissez pas","","Non","Oui :  un ou des membres de l’équipe pédagogique vous forment à l’usage de ces outils sans que ce soit des cours spécifiques","Générer des images ou des vidéos;Générer, corriger ou commenter des lignes de code (Python, R, HTML, etc.);Générer ou corriger une formule ou un calcul (Excel, MATLAB, Python…);Résumer ou reformuler des textes, articles ou cours;Trouver des explications sur un concept scientifique ou technique;Préparer ou structurer un exposé, un mémoire ou un rapport;Planifier votre travail ou organiser votre emploi du temps;Vérifier la qualité linguistique ou la clarté d’un texte","","Gagner du temps;Améliorer l’efficacité de vos apprentissages : mieux comprendre certains sujets, obtenir des explications, synthétiser les cours, etc.;Obtenir de meilleures notes : générer des contenus de qualité, éviter les erreurs, soigner la forme..;Développer vos compétences : apprendre à utiliser de nouveaux outils, améliorer vos compétences en rédaction, programmation, etc.;Augmenter votre créativité : trouver des idées nouvelles, varier vos méthodes de travail;Vous organiser : vous aider à planifier, à structurer vos projets, à gérer votre temps;Bénéficier d’une aide personnalisée, recevoir des conseils adaptés à mes besoins;Vous entraîner, vous tester : générer des questions, des tests, des quiz;Vous maintenir à niveau car tout le monde l’utilise","","Non","Oui","Vous les modifiez fortement, ils ne vous servent que de guide","Item6","Vos enseignants interdisent leur utilisation;Vous craignez pour la confidentialité des données;Vous ne voulez/pas ou ne pouvez pas payer les versions premium;Vous craignez d’être accusé de triche","","","","","","","","Travaux écrits à rendre (dossier, devoir, rapport, fiche de lecture, etc.);Devoirs sur table (questions, QCM, études de cas, problèmes, etc.);Présentations orales (exposé individuel ou en groupe, soutenance, entretien, etc.);Travaux pratiques, stages ou activités appliquées évaluées (en laboratoire, en atelier, à l’hôpital, sur le terrain, etc.);Projets ou productions à mener dans la durée (projet, mémoire, portfolio, simulation, etc.)","","Oui souvent","Très bon","Valider l’année ou obtenir le diplôme;Valider avec une mention","Item7","D'accord","Pas du tout d'accord","Pas d'accord","D'accord","Vous avez fait des connaissances;Vous avez noué des amitiés","Oui et vous en faites partie","Une fois par mois ou plus rarement","Une fois par mois ou plus rarement","Une fois par mois ou plus rarement","Tous les jours ou presque","Une fois par mois ou plus rarement","Une fois par semaine","Partager des contenus créés par une IAG*;Utiliser dans un travail commun des contenus générés par une IAG*","Au moins une fois par semaine","Des questions liées aux cours ou évaluations","","Plutôt non","",NA,"Bac + 3 à Bac + 4","Bac + 5 ou plus","Vous ne vous trouvez dans aucune de ces situations","","Oui",NA,"01/12/2025 14:29:22","01/12/2025 14:29:22","01/12/2025 14:48:42","1160,764835","FR","Smartphone","Terminé","BUT/LP",12408338,"I.U.T. 2 - ANTENNE ST MARTIN D'HERES","BUT","LSB2CO220","BUT2","Science des Données","Visualisation, Conception d'Outils Décisionnels","IUT2","Mathématiques et informatique","GRENOBLE - 2A BUT SCIENCE DES DONNEES - VISUALISATION,CONCEPTION D'OUTILS DECISIONNELS - FI/FC/RE","F",19,"Formation initiale","Série générale","Bac général",1,"Non boursier","Domicile parental","IUT (y compris post-DUT ou licence professionnelle)"
"105","Y6CW-9ZF8","Oui, vous utilisez un agenda numérique","","Anticiper le rendu en organisant le travail sur plusieurs semaines","Au moins une fois par semaine",25,"Pas assez important","Non","Jamais","Vous écoutez sans prendre de notes","","",NA,"","","Vous ne le faites pas","Vous ne le faites pas","Vous le faites avec des camarades de promotion","Vous ne le faites pas","Vous ne le faites pas","Vous ne le faites pas","Vous le faites tout seul","Vous faites des recherche complémentaires par vous-même","Sites internet;IAG*","","","Tous les jours de la semaine ou presque","Quelques jours par mois","Jamais","Tous les jours de la semaine ou presque","Copié ou déplacé des fichiers sur votre ordinateur, smartphone ou tablette;Utilisé un logiciel de bureautique (traitement de texte, tableur, diaporama...);Installé des logiciels ou des applications sur l'un de vos appareils numériques;Utilisé un logiciel spécialisé (PAO, montage, traitements statistiques, modélisation...)","Vous n'utilisez pas","Bon","Vous n'utilisez pas","Très bon","Bon","Une à deux fois par mois","Une à deux fois par semaine","Vous ne la connaissez pas","Vous ne la connaissez pas","Vous ne la connaissez pas","Vous ne l'utilisez pas","","Non","Non, vous n’avez pas reçu de formation ou vous n'en avez pas suivi vous-même","Trouver des explications sur un concept scientifique ou technique;Préparer ou structurer un exposé, un mémoire ou un rapport","","Gagner du temps;Améliorer l’efficacité de vos apprentissages : mieux comprendre certains sujets, obtenir des explications, synthétiser les cours, etc.;Obtenir de meilleures notes : générer des contenus de qualité, éviter les erreurs, soigner la forme..","","Non","Oui","Vous les modifiez fortement, ils ne vous servent que de guide","Item7","Vous préférez faire les choses par vous-même;Vous craignez de devenir dépendant","","","","","","","","Devoirs sur table (questions, QCM, études de cas, problèmes, etc.);Présentations orales (exposé individuel ou en groupe, soutenance, entretien, etc.);Travaux pratiques, stages ou activités appliquées évaluées (en laboratoire, en atelier, à l’hôpital, sur le terrain, etc.);Projets ou productions à mener dans la durée (projet, mémoire, portfolio, simulation, etc.)","","Oui souvent","Bon","Valider l’année ou obtenir le diplôme","Item5","Pas d'accord","Pas du tout d'accord","Pas d'accord","Tout à fait d'accord","Vous avez retrouvé des personnes que vous connaissiez déjà;Vous avez fait des connaissances;Vous avez noué des amitiés","Oui et vous en faites partie","Tous les jours ou presque","Une fois par mois ou plus rarement","Une fois par semaine","Tous les jours ou presque","Une fois par semaine","Une fois par semaine","Partager des contenus créés par une IAG*","Jamais","","","Pas du tout","",NA,"Bac + 3 à Bac + 4","Bac + 3 à Bac + 4","","","Non",NA,"02/12/2025 15:18:02","02/12/2025 15:18:02","02/12/2025 15:35:19","1037,335002","FR","PC","Terminé","BUT/LP",12500958,"I.U.T. 1 - SAINT MARTIN D'HERES","BUT","TDB1FI211","BUT1","Génie Mécanique et Productique","Génie Mécanique et Productique ","IUT1","Mécanique, génie mécanique","ST MARTIN D'HERES - 1A BUT GENIE MECANIQUE ET PRODUCTIQUE","M",17,"Formation initiale","STI2D-Sc&techno indust & develop. durabl","Bac techno hors gestion",1,"Boursier","Résidence universitaire","Enseignement secondaire (y compris par correspondance)"
"110","BYKA-FUMY","Non, vous ne planifiez pas","","Faire le travail les heures précédant la date finale","Au moins une fois par semaine",35,"Trop important","Oui","Plus rarement","Vous prenez des notes, mais seulement ce qui vous paraît important","","Papier (cahier, bloc-notes, feuilles, ...);Ordinateur portable",NA,"Vous les rangez dans des dossiers;Vous n'en faites rien","","Vous ne le faites pas","Vous le faites tout seul","Vous le faites tout seul","Vous le faites avec des camarades de promotion","Vous ne le faites pas","Vous le faites tout seul","Vous ne le faites pas","Vous demandez des explications","","","A un camarade de la formation;A la personne chargée de l’enseignement;A une IAG*","Tous les jours de la semaine ou presque","Tous les jours de la semaine ou presque","Jamais","Tous les jours de la semaine ou presque","Copié ou déplacé des fichiers sur votre ordinateur, smartphone ou tablette;Utilisé un logiciel de bureautique (traitement de texte, tableur, diaporama...);Ecrit un programme en langage informatique;Modifié les paramètres de votre système d'exploitation (pour régler l'affichage, ajouter des périphériques, etc.);Installé des logiciels ou des applications sur l'un de vos appareils numériques;Utilisé un logiciel spécialisé (PAO, montage, traitements statistiques, modélisation...)","Mauvais","Moyen","Bon","Moyen","Mauvais","Une à deux fois par mois","Vous ne l'utilisez pas","Vous ne l'utilisez pas","Vous ne la connaissez pas","Vous ne l'utilisez pas","Une à deux fois par semaine","Claude (plutôt aspects rédactionnel ), grok (aspects technique), deepseek ( quand c'est des demandes rees simplistes","Non","Non, vous n’avez pas reçu de formation ou vous n'en avez pas suivi vous-même","Générer, corriger ou commenter des lignes de code (Python, R, HTML, etc.);Générer ou corriger une formule ou un calcul (Excel, MATLAB, Python…);Concevoir ou optimiser un modèle / prototype / protocole;Vérifier la qualité linguistique ou la clarté d’un texte","","Gagner du temps;Améliorer l’efficacité de vos apprentissages : mieux comprendre certains sujets, obtenir des explications, synthétiser les cours, etc.;Obtenir de meilleures notes : générer des contenus de qualité, éviter les erreurs, soigner la forme..;Développer vos compétences : apprendre à utiliser de nouveaux outils, améliorer vos compétences en rédaction, programmation, etc.;Augmenter votre créativité : trouver des idées nouvelles, varier vos méthodes de travail","","Non","Oui","Vous les modifiez légèrement de façon à en gommer les défauts ou les traits reconnaissables (notamment avec un logiciel édité dans ce but)","Item6","Vous préférez faire les choses par vous-même;Vous craignez pour la confidentialité des données;Vous êtes préoccupé par les conséquences sociales et économiques;Vous ne voulez/pas ou ne pouvez pas payer les versions premium","","Oui","du debugage, des ajustements,  des validations de code","L'entreprise encourage à l'utilisation IAG* interne","","","","Travaux écrits à rendre (dossier, devoir, rapport, fiche de lecture, etc.);Devoirs sur table (questions, QCM, études de cas, problèmes, etc.);Présentations orales (exposé individuel ou en groupe, soutenance, entretien, etc.);Travaux pratiques, stages ou activités appliquées évaluées (en laboratoire, en atelier, à l’hôpital, sur le terrain, etc.);Projets ou productions à mener dans la durée (projet, mémoire, portfolio, simulation, etc.)","","Oui quelques fois","Assez bon","Vous n'avez pas ce type d'objectifs","Item7","D'accord","Pas d'accord","Pas d'accord","Pas d'accord","Vous avez retrouvé des personnes que vous connaissiez déjà;Vous avez fait des connaissances;Vous avez noué des amitiés","Oui et vous en faites partie","Une fois par mois ou plus rarement","Une fois par semaine","Une fois par mois ou plus rarement","Une fois par semaine","Jamais","Une fois par mois ou plus rarement","Utiliser dans un travail commun des contenus générés par une IAG*","Moins souvent","Le suivi d’un stage, projet ou mémoire","","Plutôt oui","Vous êtes proche aidant",NA,"Baccalauréat","Aucun ou BEPC","Vous ne souhaitez pas répondre","","Oui",NA,"01/12/2025 15:09:02","01/12/2025 15:09:02","01/12/2025 15:30:15","1273,932172","FR","PC","Terminé","BUT/LP",12314615,"I.U.T. 2 - ANTENNE ST MARTIN D'HERES","BUT","LSB3EM230","BUT3","Science des Données","Exploration et Modélisation Statistique","IUT2","Mathématiques et informatique","GRENOBLE - 3A BUT SCIENCE DES DONNEES - EXPLORATION ET MODELISATION STATISTIQUE - TTR","M",20,"Contrat d'apprentissage","Série générale","Bac général",1,"Non boursier","Domicile parental","IUT (y compris post-DUT ou licence professionnelle)"
"111","HEBA-SJXA","Non mais vous planifiez différemment","Avec des alarmes","Faire le travail quelques jours avant la date finale","Au moins une fois par semaine",34,"Trop important","Non","Plus rarement","Vous prenez des notes, mais seulement ce qui vous paraît important","","Papier (cahier, bloc-notes, feuilles, ...)",NA,"Vous les rangez dans des dossiers","","Vous le faites tout seul","Vous le faites avec des camarades de promotion","Vous le faites tout seul;Vous le faites avec des camarades de promotion","Vous le faites tout seul;Vous le faites avec des camarades de promotion","Vous ne le faites pas","Vous le faites tout seul;Vous le faites avec des camarades de promotion","Vous ne le faites pas","Vous faites des recherche complémentaires par vous-même;Vous demandez des explications","IAG*","","A un camarade de la formation;A la personne chargée de l’enseignement","Tous les jours de la semaine ou presque","Deux jours par semaine","Tous les jours de la semaine ou presque","Deux jours par semaine","Copié ou déplacé des fichiers sur votre ordinateur, smartphone ou tablette;Utilisé un logiciel de bureautique (traitement de texte, tableur, diaporama...);Installé des logiciels ou des applications sur l'un de vos appareils numériques","Vous n'utilisez pas","Vous n'utilisez pas","Vous n'utilisez pas","Bon","Vous n'utilisez pas","Une à deux fois par mois","Une à deux fois par semaine","Vous ne l'utilisez pas","Vous ne la connaissez pas","Vous ne la connaissez pas","Vous ne la connaissez pas","","Non","Non, vous n’avez pas reçu de formation ou vous n'en avez pas suivi vous-même","Créer des quiz, exercices ou fiches de révision","","Gagner du temps;Améliorer l’efficacité de vos apprentissages : mieux comprendre certains sujets, obtenir des explications, synthétiser les cours, etc.;Bénéficier d’une aide personnalisée, recevoir des conseils adaptés à mes besoins","","Non","Non","Cela ne vous concerne pas, vous n'en utilisez pas","Item7","Vous ne savez pas très bien vous en servir;Vous préférez faire les choses par vous-même;Vos enseignants interdisent leur utilisation;Vous considérez que c’est une forme de triche","","","","","","","","Travaux écrits à rendre (dossier, devoir, rapport, fiche de lecture, etc.);Devoirs sur table (questions, QCM, études de cas, problèmes, etc.);Travaux pratiques, stages ou activités appliquées évaluées (en laboratoire, en atelier, à l’hôpital, sur le terrain, etc.)","","Oui souvent","Assez bon","Valider l’année ou obtenir le diplôme","Item8","Pas d'accord","Pas d'accord","Pas d'accord","Tout à fait d'accord","Vous avez retrouvé des personnes que vous connaissiez déjà;Vous avez fait des connaissances;Vous avez noué des amitiés","Oui et vous en faites partie","Tous les jours ou presque","Une fois par semaine","Une fois par semaine","Une fois par semaine","Une fois par semaine","Une fois par semaine","Partager des contenus créés par une IAG*","Moins souvent","Des questions liées aux cours ou évaluations","","Pas du tout","",NA,"Bac + 3 à Bac + 4","Bac + 5 ou plus","Vous ne vous trouvez dans aucune de ces situations","","Oui",NA,"02/12/2025 16:08:41","02/12/2025 16:08:41","02/12/2025 16:20:52","730,2310881","FR","Smartphone","Terminé","BUT/LP",12503224,"I.U.T. 1 - SAINT MARTIN D'HERES","BUT","TBB1FI211","BUT1","Génie Civil Construction Durable","Génie Civil Construction Durable","IUT1","Génie civil","ST MARTIN D'HERES - 1A BUT GENIE CIVIL - CONSTRUCTION DURABLE","M",18,"Formation initiale","STI2D-Sc&techno indust & develop. durabl","Bac techno hors gestion",1,"Boursier","Autre mode d'hébergement","Enseignement secondaire (y compris par correspondance)"
"114","DR5T-5F5Q","Oui, vous utilisez un agenda numérique","","Anticiper le rendu en organisant le travail sur plusieurs semaines","Au moins une fois par semaine",35,"Adapté","Non","Chaque semaine ou presque","Vous cherchez à prendre en note tout ce que vous entendez;Vous prenez des notes, mais seulement ce qui vous paraît important","","Ordinateur portable",NA,"Vous les relisez;Vous surlignez / soulignez / entourez les éléments importants;Vous les rangez dans des dossiers","","Vous le faites tout seul;Vous le faites avec des camarades de promotion","Vous le faites tout seul;Vous le faites avec des camarades de promotion;Vous le faites avec une IAG*","Vous le faites tout seul;Vous le faites avec des camarades de promotion","Vous le faites tout seul;Vous le faites avec des camarades de promotion","Vous le faites tout seul","Vous ne le faites pas","Vous le faites tout seul","Vous faites des recherche complémentaires par vous-même;Vous demandez des explications","Articles de recherche (revues scientifiques);Sites internet;Réseaux sociaux (Instagram, TikTok…)","","A un camarade de la formation;A un ou une de mes amis;A un ou une membre de ma famille;A la personne chargée de l’enseignement","Deux jours par semaine","Tous les jours de la semaine ou presque","Tous les jours de la semaine ou presque","Tous les jours de la semaine ou presque","Copié ou déplacé des fichiers sur votre ordinateur, smartphone ou tablette;Utilisé un logiciel de bureautique (traitement de texte, tableur, diaporama...);Modifié les paramètres de votre système d'exploitation (pour régler l'affichage, ajouter des périphériques, etc.);Installé des logiciels ou des applications sur l'un de vos appareils numériques;Utilisé un logiciel spécialisé (PAO, montage, traitements statistiques, modélisation...);Changé votre système d'exploitation (au delà des mises à jour)","Bon","Très bon","Vous n'utilisez pas","Vous n'utilisez pas","Vous n'utilisez pas","Tous les jours ou presque","Une à deux fois par semaine","Vous ne l'utilisez pas","Vous ne l'utilisez pas","Vous ne l'utilisez pas","Vous ne la connaissez pas","","Non","Non, vous n’avez pas reçu de formation ou vous n'en avez pas suivi vous-même","Concevoir des supports visuels (infographies, schémas, présentations);Générer des images ou des vidéos;Résumer ou reformuler des textes, articles ou cours;Concevoir ou optimiser un modèle / prototype / protocole;Préparer ou structurer un exposé, un mémoire ou un rapport;Vérifier la qualité linguistique ou la clarté d’un texte","","Améliorer l’efficacité de vos apprentissages : mieux comprendre certains sujets, obtenir des explications, synthétiser les cours, etc.;Augmenter votre créativité : trouver des idées nouvelles, varier vos méthodes de travail;Bénéficier d’une aide personnalisée, recevoir des conseils adaptés à mes besoins;Vous entraîner, vous tester : générer des questions, des tests, des quiz","","Oui","Non","Vous les modifiez fortement, ils ne vous servent que de guide","Item8","Vous craignez d’être accusé de triche;Vous considérez que c’est une forme de triche;Vous craignez de devenir dépendant","","","","","","","","Travaux écrits à rendre (dossier, devoir, rapport, fiche de lecture, etc.);Devoirs sur table (questions, QCM, études de cas, problèmes, etc.);Présentations orales (exposé individuel ou en groupe, soutenance, entretien, etc.);Projets ou productions à mener dans la durée (projet, mémoire, portfolio, simulation, etc.)","","Oui souvent","Assez bon","Valider l’année ou obtenir le diplôme","Item9","D'accord","Pas du tout d'accord","D'accord","Tout à fait d'accord","Vous avez retrouvé des personnes que vous connaissiez déjà;Vous avez fait des connaissances;Vous avez noué des amitiés","Oui et vous en faites partie","Tous les jours ou presque","Une fois par semaine","Une fois par semaine","Une fois par semaine","Une fois par semaine","Une fois par semaine","Partager des contenus créés par une IAG*;Utiliser dans un travail commun des contenus générés par une IAG*","Jamais","","","Plutôt oui","Vous avez un travail rémunéré en parallèle de vos études",NA,"Bac + 5 ou plus","Baccalauréat","Vous ne vous trouvez dans aucune de ces situations","","Non",NA,"03/12/2025 13:47:09","03/12/2025 13:47:09","03/12/2025 13:58:16","666,785558","FR","Smartphone","Terminé","BUT/LP",12412687,"I.U.T. 2 - GRENOBLE","BUT","LKB2CO220","BUT2","Information - Communication","Communication des Organisations","IUT2","Sciences de l'info. et de la communicat.","GRENOBLE- 2A BUT INFORMATION PARCOURS COMMUNICATION DES ORGANISATIONS-FI-FC-RE","F",19,"Formation initiale","STMG -Sc. Techno. management et gestion","Bac STMG",1,"Non boursier","Domicile parental","IUT (y compris post-DUT ou licence professionnelle)"
"119","RQJ4-V6H7","Oui, vous utilisez un agenda numérique","","Faire le travail quelques jours avant la date finale","Au moins une fois par semaine",27,"Adapté","Non","Jamais","Vous prenez des notes, mais seulement ce qui vous paraît important","","Papier (cahier, bloc-notes, feuilles, ...);Ordinateur portable",NA,"Vous les relisez;Vous les rangez dans des dossiers","","Vous ne le faites pas","Vous le faites tout seul","Vous le faites tout seul","Vous le faites tout seul","Vous ne le faites pas","Vous le faites tout seul","Vous le faites tout seul;Vous le faites avec des camarades de promotion","Vous faites des recherche complémentaires par vous-même;Vous demandez des explications","Sites internet","","A un camarade de la formation;A la personne chargée de l’enseignement","Tous les jours de la semaine ou presque","Tous les jours de la semaine ou presque","Jamais","Tous les jours de la semaine ou presque","Copié ou déplacé des fichiers sur votre ordinateur, smartphone ou tablette;Utilisé un logiciel de bureautique (traitement de texte, tableur, diaporama...);Ecrit un programme en langage informatique;Modifié les paramètres de votre système d'exploitation (pour régler l'affichage, ajouter des périphériques, etc.);Installé des logiciels ou des applications sur l'un de vos appareils numériques;Utilisé un logiciel spécialisé (PAO, montage, traitements statistiques, modélisation...);Changé votre système d'exploitation (au delà des mises à jour)","Vous n'utilisez pas","Bon","Très bon","Vous n'utilisez pas","Moyen","Vous ne l'utilisez pas","Vous ne l'utilisez pas","Vous ne l'utilisez pas","Vous ne la connaissez pas","Vous ne la connaissez pas","Vous ne l'utilisez pas","","Non","Non, vous n’avez pas reçu de formation ou vous n'en avez pas suivi vous-même","","","","","","","","","","","","","","","Vous préférez faire les choses vous-même;Vous craignez pour la confidentialité des données;Vous êtes préoccupé par les conséquences sociales et économiques;Vous considérez que c’est une forme de triche","","Travaux écrits à rendre (dossier, devoir, rapport, fiche de lecture, etc.);Devoirs sur table (questions, QCM, études de cas, problèmes, etc.);Présentations orales (exposé individuel ou en groupe, soutenance, entretien, etc.);Projets ou productions à mener dans la durée (projet, mémoire, portfolio, simulation, etc.)","","Oui quelques fois","Bon","Valider l’année ou obtenir le diplôme","Item4","","","","","","Oui et vous en faites partie","Une fois par semaine","Une fois par mois ou plus rarement","Une fois par mois ou plus rarement","Une fois par semaine","Une fois par mois ou plus rarement","Une fois par semaine","","Au moins une fois par semaine","Des questions liées aux cours ou évaluations","","Pas du tout","",NA,"Vous ne savez pas / Non concerné-e","Vous ne savez pas / Non concerné-e","","","Non",NA,"02/12/2025 13:28:56","02/12/2025 13:28:56","02/12/2025 13:44:31","935,0265908","FR","Smartphone","Terminé","BUT/LP",12402564,"I.U.T. 2 - GRENOBLE","BUT","LIB2RA220","BUT2","Informatique","Réalisation d'Applications, Conception, Développement, Validation","IUT2","Informatique","GRENOBLE - 2A BUT INFORMATIQUE - REALISATION D'APPLICATIONS, CONCEPTION, DEVELOPPEMENT, VALIDATION - FI/FC/RE","M",19,"Formation initiale","Série générale","Bac général",1,"Non boursier","Logement personnel hors chambre étudiant","IUT (y compris post-DUT ou licence professionnelle)"
